dedup,hf_label
harap jae park rizky febian alamak spotify wrapped rcti,Neutral
rizky febian alamak hari rasa jatuh cinta terus,Positive
alamak rizky febian adrian khalif faliza khaira,Neutral
rizky febian alamak,Neutral
lagu rizky febian kak judul alamak sembilan nyawa mau mu semua,Neutral
akhir dengerin alamak rizky febian lagu jatuh cinta,Positive
juara yamaha indonesia nyata alamak rizky febian adrian khalif acara dukung,Positive
susun lagu wajib nikah akhir lama alamak rizky febian,Positive
sedia hujan alamak kolaborasi kacamata elu,Neutral
pusing dengerin lagu alamak rizky febian guna gerak terus suara kanan kiri awal senang lama dengar,Negative
alamak rizky febian santai,Neutral
kamera gemar alamak sekarang main festival nilai bandung,Positive
beri hafal,Positive
rizky febian alamak,Neutral
keren rizky febian adrian khalif alamak,Positive
febian adrian khalif alamak,Neutral
alamak rizky febian adrian khalif bawa lewat youtube,Neutral
posisi rizky febian kolaborasi adrian khalif alamak stay tuned atas,Positive
penuh komen,Neutral
nyanyi kolaborasi alamak sama ipit,Neutral
ucap nama cinta rizky febian kolaborasi adrian khalif alamak,Positive
kata rizky febian alamak ini jatuh cinta,Positive
rizky febian alamak asal bunyi,Negative
alamak kolaborasi sedia hujan elu kacamata,Neutral
suka alamak malam rawan rizky febian,Positive
alamak rizky febian bapak suami,Neutral
seonghyeon sempurna andra backbone alamak rizky febian adrian khalif perempuan sedang peluk payung teduh james lesung pipi raim laode martin cinta judika lagu cocok,Positive
biasa nilai kasihan ronde lagu alamak rizky febian sembilan nyawa ulang pukul keren,Negative
rizky febian sama adrian khalif lewat sendiri alamak resmi masuk nominasi kolaborasi tahun vote sekarang lalu aplikasi langit musik jadi karya juara klik,Positive
nik tsunami rizky febian kolaborasi adrian khalif alamak,Neutral
aduh jalan mall tiba rizky febian bawain alamak ingat jacob mohon serius selesai sedih tegang,Neutral
alamak rizky febian,Neutral
bawa sangat bagus milik buat satu diri sini suka bagi aransemen benar alamak rizky febian adrian khalif kapan versi mohon orang ajarin cara gabung instrumen,Positive
spotify putar lagu alamak rizky febian lanjut serah raisa sebenernya mau kasmaran galau dengar jadi bingung,Positive
sekarang main alamak rizky febian,Neutral
rizky febian alamak di tinggal pict bae suzy han kyung aiki kyoka waktu kira jadi selingkuh padahal putus baru mantan deketin karena keren preman pasar gada pined drink,Positive
adrian khalif baru nyanyi alamak kolaborasi rizky febian cewe istri,Neutral
alamak kolaborasi,Neutral
rizky febian jadi buka acara tiktok awards selenggara malam hari jumat sempat duet sama adrian khalif nyanyi lagu judul alamak,Positive
jajar besar indonesia artist acara spotify keren pulang seperti update buah foto instagram guna lagu na alamak adrian khalif rizky febian justru galau mahalini,Neutral
bukan alamak duet sama rizky febian,Neutral
rizky febian alamak enak,Positive
lagu rizky febian adrian khalif minimal produk alamak ini jatuh cinta,Neutral
bagus main gais bener lagu rizky febian alamak biasa direply tambah telat aje,Positive
alamak terus rizky febian,Neutral
biasa suka lagu indonesia lirik banyak guna bahasa hari justru baku puitis geli turut alamak rizky febian adrian khalif punya mampu tulis it benar kerja wel rhyme flow semua mabuk hingga,Positive
kira selesai segera alamak rizky febian adrian khalif bawa jepang versi keren,Positive
kira selesai segera alamak rizky febian adrian khalif bawa jepang versi keren,Positive
kira selesai segera alamak rizky febian adrian khalif bawa jepang versi keren,Positive
kira selesai segera alamak rizky febian adrian khalif bawa jepang versi keren,Positive
rizky febian adrian khalif alamak resmi lirik video lalu,Neutral
juara mingu yamaha indonesia rizky febian adrian khalif sendiri alamak acara sembah,Neutral
benar tertawa bagi seter rizky febian sangat alamak seperti kunto aji butuh rehat yak nilai lagu rumah bukan,Positive
alamak kolaborasi sedia hujan kacamata elu,Neutral
sedang putar rizky febian kolaborasi adrian khalif alamak,Positive
nyanyin reffnya alamak rizky febian huruf vokal ganti waktu menit,Neutral
alamak rizky febian adrian khalif bawa keren nyawa mau semua,Positive
alamak rizky febian adrian khalif bawa keren buat kesima,Positive
alamak rizky febian adrian khalif bawa keren naga telah jatuh cinta,Positive
alamak rizky febian adrian khalif bawa keren langit bagus,Positive
alamak,Neutral
dijepang nyanyi lagu jepang tiba asia keliling mampir indonesia rizky febian alamak kali nang,Positive
bukankah bagaimana alamak rizky febian kolaborasi adrian khalif,Neutral
bismilahirahmanirahim alamak rizky febian kacamata afgan cinta buah buka pintu frozen inti kereta kencan hivi satu waktu pergi boynextdor cepat akhir festival jalur nik dependent kenan te,Positive
atas ulang alamak rizky febian adrian khalif titik nadir kahitna monita tahalea tetap bukan raisa rony parulian adu bola mata tiara andini kemari tenang mahalini kata ziva magnolya kacamata afgan jurus jitu hara gabriela katseye pergi cortis,Neutral
hai rewrite nyanyi biru waktu pergi boynextdor mejikuhibiu beri aba atached tenxi naykila jemsi untung cinta alamak rizky febian kacamata afgan,Neutral
rizky febian alamak,Neutral
bayang nyanyi lagu alamak rizky febian cocok tema keliling nyawa mau,Positive
satu bulan bernadya alamak rizky febian kolaborasi adrian khalif,Neutral
alamak rizky febian semenjak diri hivi,Neutral
alamak rizky febian bagus cukup pahlawan,Positive
edit belum guna bagaimana alamak rizky febian,Neutral
alamak rizky febian,Neutral
serius hari muterin lagu rizky febian alamak bos jatuh cinta bagi berapa,Positive
misal asli indonesia mungkin bakal nyanyin alamak rizky febian cocok,Positive
tyla salur le serafim mutiara rizky febian alamak hivi pelangi,Neutral
jacob bawa alamak rizky febian kolaborasi adrian khalif versi,Neutral
original artis rizky febian adrian khalif reposted cobie bawa alamak atas cerita instagram komen,Positive
rizky febian adrian khalif alamak bawa jacob kelompok,Neutral
jacob bawa alamak rizky febian kolaborasi adrian khalif,Neutral
pajama karaoke jacob alamak rizky febian adrian khalif,Neutral
egk jebes indonesia bawa lagu rizky febian alamak wkwkwkwkwk,Neutral
api jakarta alamak,Neutral
kelompok jacob nyanyi alamak rizky febian,Positive
pernah gak pikir idola kpop nyanyi lagu alamak rizky febian,Neutral
jacob alamak rizky febian adrian khalif,Neutral
nyanyi jacob kelompok bawa lagu alamak rizky febian adrian khalif konser jakarta hari,Positive
jacob nyanyi alamak rizky febian adrian khalif,Positive
jacob nyanyi alamak rizky febian adrian khalif,Positive
multo cangkir joe alamak rizky febian fuji kaze shinunoga wa,Neutral
km erti lagu rizky febian alamak lirik sembilan nyawa lewat terus sosmedku,Positive
kok alamak rizky febian benci musik indonesia ckck,Negative
jacob dengar indonesia musik tulus hati jalan rizky febian adrian khalif alamak fourtwnty kolaborasi charita utami mangu nadhif gema lama kaleb sekarang erti niken salindry bokong semok glen fredly beri putih,Neutral
jacob nyetel alamak rizky febian dada isi semua,Positive
pahlawan sedang than rizky febian alamak taylor swift opalite,Neutral
tulus jatuh suka rizky febian alamak,Neutral
spotify hari top indonesia pamungkas monolog hindia segala nadhif basalamah gema lama silet buka besar tabola bale jacson seran juan reza diva aurel rizky febian alamak adrian khalif ht,Positive
sekarang main rizky febian alamak,Positive
sesi kuno pacu melodi wc hp turn ganjil gera mortis dada isi semua alamak jatuh cinta rizky febian,Positive
gaun taylor swift delicate nasib ophelia alamak rizky febian everyday ariana grande sure thing miguel berharsp susun buah banyak ts y swifties sieh,Neutral
la hahahaha alamak rizky febian,Neutral
sekarang main alamak rizky febian heidisecret loptel yinwar,Positive
suka dengar lagu alamak rizky febian kolaborasi adrian khalif musik enak suara dua pengalan lirik ikut wadidaw buat jatuh cinta,Positive
rizky febian adrian khalif alamak hindia segala yovie widianto tulus glen fredly adu rayu,Neutral
rizky febian kolaborasi adrian khalif alamak,Neutral
alamak rizky febian roy faliza,Neutral
rizky febian alamak,Neutral
atas ulang takut cinta pink manis suami pergi atmcg lihat kebun jeje langit favorit terdy adhitya atached tenxi ananga suisei simple kena michael careon alamak rizky febian adrian khalif galau tb jatuh tahun edan,Positive
atas ulang ros number satu girl toxic til end apt dance semua night mesy jenie extral blackpink aespa katseye musik style rizky febian alamak samuel cipta senja sudut kota,Neutral
lagu rizky febian baru kakak judul alamak harus sekali pernah dengar salah betul,Positive
kak seni sangat alamak bukan lagu rizky febian,Positive
nyata mingu alamak rizky febian adrian khalif duduk posisi puncak yamaha indonesia acara sembah,Positive
atas ulang nasib ophelia taylor swift bez perangkap nicki minaj bahasa kalbu titi dj milik sama mariah carey bunga liar bilie eilish alamak rizky febian adrian khalif,Neutral
alamak rizky febian cobie buat sure research tulis waktu,Neutral
alamak kolaborasi sedia hujan salah jatuh cinta elu,Neutral
bagan alamak naik peringkat sob,Positive
alamak rizky febian adrian,Neutral
orang m waspada buah banyak kerja atas terima justru susut ema spam lucu gambar kena ingin apabila sedang sabar alamak rizky febian adrian khalif,Neutral
selamat rizky febian lagu udara alamak malam rawan,Positive
nyanyin lagu rizky febian judul alamak kata jatuh cinta,Positive
biasa mendenhgar lambat musik rizky febian alamak some ed sheran nik taylor swift buah few k pop tracks butuh lembut tonton film hary poter aladin pidana adil sembunyi cinta anything bagus puls,Positive
alamak rizky febian adrian khalif,Neutral
rizky febian adrian khalif alamak,Neutral
spotify hari top indonesia pamungkas monolog hindia segala nadhif basalamah gema lama rizky febian alamak adrian khalif silet buka besar tabola bale jacson seran juan reza diva aurel ht,Positive
adik baemon nomor quen lyodra sering dengar bodoh ost demo rizky febian alamak candu jakarta masuk boyzone baru lik,Positive
rizky febian nyanyi panjang tulis sangat lucu funy momen second alamak sama apabila tanya salting yes sebut some improve,Positive
salah biasa suka pakai orang garuk jeje lihat kebun taman bunga rizky febian adrian khalif alamak,Neutral
raim laode lesung pipi rizky febian adrian khalif alamak ngarang,Neutral
alamak rizky febian tuh enak mn tipe sm lagu tungu memori dengerin jalan jyujyur,Positive
ken dengar buah iky salma nyanyi alamak senang,Positive
afgan kacamata rizky febian adrian khalif alamak,Neutral
spotify hari top indonesia pamungkas monolog nadhif basalamah gema lama hindia segala rizky febian alamak adrian khalif silet buka besar tabola bale jacson seran juan reza diva aurel ht,Positive
alamak rizky febian enih jelas lirik yh xixi mau sofi gak,Neutral
rizky febian alamak sembilan nyawa mau sifut terus bikin nyaman ea,Positive
siapa sangka glen samuel alamak rizky febian kolaborasi adrian khalif tawan,Positive
shinta individu autistik dewasa coba meng bawa bas lagu alamak rizky febian lengkap partitur chord mohon langgan ikut terimakasih dukung youtube salur instagram,Positive
spotify hari top indonesia pamungkas monolog nadhif basalamah gema lama rizky febian alamak adrian khalif hindia segala silet buka besar tabola bale jacson seran juan reza diva aurel,Positive
mairacam alamak rizky febian bawa c vt personal sapa festival saudara reuni,Neutral
harta karun sekarang lama jiso zayn mata tutup rizky febian adrian khalif alamak toton caribo wiz baker fresky nikijuluw ngapain repot sebenernya era cinta pulse sering dengerin,Positive
alhamdulilah alah kuping kalian oke akhir bener jawabanya ialah rizky febian kolaborasi adrian khalif alamak suka nonton sound soleram buat qrt jawab tepat waktu baik hati,Positive
heso rizky febian kolaborasi andrian khalif alamak diva hani sela ovi suka nonton sound soleram,Positive
heso soleram suka nonton sound alamak rizky febian adrian khalif,Positive
heso oktavia zahra suka nonton sound rizky febian kolaborasi adrian khalif alamak soleram,Positive
heso rizky febian adrian alamak,Neutral
kasmaran jaz alamak rizky febian,Neutral
silet buka besar tabola bale rizky febian kolaborasi adrian khalif alamak,Positive
sekarang main alamak rizky febian adrian khalif,Positive
rizky febian adrian khalif alamak elvis presley can t tahan diri faling cinta,Positive
kaamera kamera gemar saudara reuni jakarta akb personal mng festival alamak rizky febian bawa c,Neutral
spotify hari top indonesia pamungkas monolog rizky febian alamak adrian khalif nadhif basalamah gema lama silet buka besar tabola bale jacson seran juan reza diva aurel hindia segala ht,Neutral
lagu rizky febian alamak hyung dengerin enak,Positive
lewat bawa alamak rizky febian adrian khalif mahasiswi ukm unit seni budaya usakti bagi alas kuliah trisakti pilih baik sini tumbuh kreasi prestasi sama,Positive
mingu posisi puncak yamaha indonesia pegang rizky febian adrian khalif alamak acara dukung,Neutral
rizky febian alamak,Neutral
alamak rizky febian amin paling serius nadin kolaborasi sal priadi cincin hindia gema lama nadhif,Neutral
alamak rizky febian kasih isya levronka habit louis tomlinson lalu gelap satu arah stupid harta karun,Neutral
tungu nyoman paul alamak rizky febian kolaborasi adrian khalif awal kisah lama raisa,Neutral
relate tulis alamak rizky febian kolaborasi adrian khalif pokok,Neutral
sering dengar alamak rizky febian kolaborasi adrian khalif nyata tahan juara sembah yamaha mingu,Positive
alamak kolaborasi salah jatuh cinta adu bola mata lihat kebun taman bunga jeje,Neutral
minho tangan kasih material alamak rizky febian tulis indonesia,Neutral
alamak rizky febian cocok sempuna,Positive
cangkir joe multo bayi monster panas saus zed tengah alamak rizky febian,Neutral
berharsp rizky febian alamak nik hati dna rose mesy,Neutral
lagu alamak rizky febian kolaborasi adrian khalif lirik cocok video,Positive
alamak kolaborasi salah jatuh cinta lihat kebun taman bunga jeje,Positive
spotify hari top indonesia pamungkas monolog nadhif basalamah gema lama rizky febian alamak adrian khalif silet buka besar tabola bale jacson seran juan reza diva aurel hindia segala ht,Neutral
tkle beda suara rizky febian adrian khalif dlm lagu alamak ni,Neutral
lagu alamak rizky febian kolaborasi adrian khalif bawain mama uthe beda tetep enak,Positive
kocak temen shalat magrib orang dzikir tiba nyanyi lagu rizky febian alamak refleks kata,Neutral
alamak rizky febian,Neutral
becanda mba mohon jangan nang mau main dije alamak rizky febian adrian khalif jatuh aneth,Neutral
kamera gemar fokus alamak rizky febian adrian khalif,Neutral
nama alamak rizky febian,Neutral
numb satu indonya fajar nor tuhan erti saling cinta rizky febian alamak tiara bukan untuku,Neutral
duet chalenge alamak rizky febian adrian khafif telat sempetnya baru sekarang,Negative
eziel bian dewandaru rizky febian adrian khalif alamak alasanya kecintan selina becanda enak lagu buat didenger senang gampang masuk telinga join fren,Positive
numb satu indonya fajar nor tuhan erti saling cinta rizky febian alamak tiara bukan untuku,Neutral
entah kapan lagu rizky febian alamak ulang hari,Neutral
np rizky febian alamak,Neutral
alamak,Neutral
jakarta vaok lagu baru rizky febian ceria judul alamak banyak pakai media sosial,Neutral
rizky febian alamak raisa awal kisah lama,Neutral
rizky febian alamak kisah,Neutral
spotify hari top indonesia pamungkas monolog rizky febian alamak adrian khalif nadhif basalamah gema lama silet buka besar tabola bale jacson seran juan reza diva aurel hindia segala,Neutral
ib alamak rizky febian kolaborasi adrian khalif,Neutral
lagu alamak rizky febian jajar paling suka dada isi semua hm alias nasi padang surya benhil,Positive
adrian khalif literaly caried alamak rizky febian,Neutral
rizky febian alamak iqbale bawah sorot lampu taylor swift wi li t,Neutral
akhir tulus langit abu rizky febian alamak celine dion cinta,Neutral
hadir vagetoz alamak rizky febian adrian khalif,Neutral
kolaborasi viral candu vokal harmonisasi ngeblend produksi r b senang review alamak mv kini yt nonton sini,Neutral
pov purbaya bawa lagu alamak rizky febian sembilan naga mau sama semua dana isi koruptor konoha,Negative
rizky febian alamak afgan kacamata suami malu,Negative
halo nuna selamat hari buat twice sunbae lagu relate belakang rizky febian alamak nun sering putar akhir,Neutral
alamak lagu rizky febian kakak,Neutral
suka dengerin lagu alamak rizky febian,Positive
rizky febian adrian alamak,Neutral
kakak nyanyi adek rencana nyanyin alamak rizky febian adrian khalif,Neutral
rizky febian alamak celine dion cinta,Neutral
saudara reuni jakarta akb personal sapa festival sembilan nyawa mau sama semua dada isi alamak jatuh cinta rizky febian,Positive
alamak rizky febian adrian khalif saudara reuni personal sapa jakarta,Neutral
astrela virgiananda saudara reuni jakarta akb personal sapa festival alamak rizky febian adrian khalif,Neutral
spotify hari top indonesia pamungkas monolog rizky febian alamak adrian khalif nadhif basalamah gema lama hindia segala silet buka besar tabola bale jacson seran juan reza diva aurel,Neutral
alamak rizky febian adrian khalif,Neutral
gak rizky febian ken dengar lagu alamak wkwkwk mora our pride n joy,Neutral
lagu alamak milik rizky febian adrian khalif turun posisi top spotify indonesia kalah monolog pamungkas lalu detikpop,Neutral
global people bagan mingu balik lagu tahan jawara lewat sendiri buang waktu naik peringkat kolaborasi alamak,Positive
mahalini libra akila model mv baru suami alamak lagu kolaborasi rizky febian adrian khalif viral sekarang milik music video konsep musisi boyong pasang real life bintang utama langsung tonton,Neutral
lagu rizky febian alamak beneran sopan kuping njir,Positive
cocok suara latar lagu rizky febian alamak,Positive
dengar alamak rizky febian during lunch then bom duduk depan kau rasa can t henti grining ni,Positive
spotify hari top indonesia pamungkas monolog rizky febian alamak adrian khalif nadhif basalamah gema lama hindia segala silet buka besar tabola bale jacson seran juan reza diva aurel ht,Positive
berharsp satu hari ismail izani duet rizky febian sleq hasil alamak versi lebih segar rangup agitew,Neutral
alamak rizky febian adrian khalif,Neutral
nyanyi kolaborasi alamak baru sama ipit,Neutral
suju cinta yesung pink sihir rizky febian adrian khalif alamak,Neutral
rizky febian adrian khalif alamak sangat lay bankz cantik wanita,Positive
rizky febian mahalini bikin tonton baper lewat video klip alamak asa manis lalu detikpop,Neutral
rizky febian mahalini bikin tonton baper lewat video klip alamak asa manis lalu,Neutral
funy ystd nurses semua ulang kali nyanyi alamak rizky febian hadir satu sabar sembilan nyawa mau mu sahaja,Neutral
alamak rizky febian andrian khalif faliza khaira,Neutral
erti lagu alamak rizky febian,Neutral
kolaborasi adrian khalif rizky febian lagu alamak akhir sedia video musik mv resmi luncur oktober,Neutral
rizky febian alamak nik hati,Neutral
mingu yamaha indonesia nyata milik juara baru rizky febian adrian khalif alamak acara dukung,Neutral
rol haechan alamak rizky febian adrian khalif,Neutral
sambung lagu alamak rizky febian phantylia asat modmaker bikin konten sini korban pertama tak bos sendiri nanok teh lia nyodorin mic gaya mau khaslana semua,Neutral
lagu rizky febian adrian khalif judul alamak enak sumur ladang boleh tumpang mandi,Neutral
lirik lagu alamak rizky febian bukan,Neutral
egk kelas mohon langsung alamak date buka space ketemu rizky febian,Neutral
siapa sangka dapet surprise alamak bonus rizky febian,Neutral
dengar alamak rizky febian adrian khalif sadar wil favorite china pinguin kopi toping,Neutral
amin paling serius nadin sal buah pasang minutes olivia dean alamak rizky febian back rahmania astrini awal kisah lama raisa,Positive
alamak kolaborasi bodoh awal kisah lama adu bola mata,Negative
spotify hari top indonesia pamungkas monolog rizky febian alamak adrian khalif nadhif basalamah gema lama silet buka besar tabola bale jacson seran juan reza diva aurel hindia segala,Neutral
akhir dengerin lagu rizky febian alamak tuh suka senyum gak waras,Positive
selamat nikmat kurang buruk suara latar kredit tulis alamak rizky febian rock bawa den pamungkas aster eth,Neutral
alamak rizky febian,Neutral
rizky febian alamak ini jatuh cinta,Positive
sapa tak berani minta cium emang rizky febian alamak,Negative
liat klip video alamak rizky febian kaya nahan ketawa panjang ambil iya,Neutral
spotify hari top indonesia rizky febian alamak adrian khalif pamungkas monolog silet buka besar tabola bale jacson seran juan reza diva aurel nadhif basalamah gema lama hindia segala ht,Neutral
rizky febian adrian khalif alamak resmi lirik video lewat,Neutral
bener suka bapak rambut gin gagah berani ganteng tampan lama nyanyin alamak rizky febian ni,Positive
mimin akhir suka dengar lagu alamak rizky febian kolaborasi adrian khalif halaman terus sosial media yuk komen minta favorit rb pagi tampil sembah naldy ervanda syifa aulia,Positive
minta alamak rizky febian kolaborasi adrian khalif kakak sdh ikut,Neutral
sekarang main rizky febian alamak,Neutral
rizky febian adrian khalif alamak,Neutral
alamak rizky febian kolaborasi adrian khalif,Neutral
dengar alamak rizky febian kepala lirik ubah sumur ladang pantun lahir pre,Neutral
wow rizky febian alamak nadhif basalamah gema lama tabola bale,Neutral
king nasar mati lampu ziva cukup mangu remix wisnu santika juicy luicy lantas rizky febian alamak cantik bunyi sik senang,Positive
juicy luicy bukan orang ziva cukup rizky febian alamak mangu remix wisnu santika king nasar mati lampu,Neutral
sembilan nyawa lagu rizky febian judul alamak baru erti awoqowoq,Neutral
rizky febian alamak malam rawan samuel senja sudut kota,Neutral
alamak rizky febian,Neutral
rizky febian adrian khalif alamak nyawa lagu trending lalu,Neutral
spotify hari top indonesia rizky febian alamak adrian khalif pamungkas monolog nadhif basalamah gema lama silet buka besar tabola bale jacson seran juan reza diva aurel hindia segala,Positive
alamak rizky febian mata tutup jiso zayn,Neutral
sembilan nyawa mau sama semua dada isi alamak jatuh cinta rizky febian adrian khalif,Positive
harus kau bawa lagu alamak milik rizky febian,Neutral
milik akses weverse gitu rekomendasin alamak rizky febian jacob member mohon,Neutral
le serafim antifragile rizky febian alamak,Neutral
alamak rizky febian kakak lenamiu siam paragon,Neutral
nonton virtual video rizky febian alamak,Neutral
cobie dindo alamak rizky febian,Neutral
buat suka dengar lagu baru kolaborasi adrian khalif rizky febian tahu,Positive
rizky febian adrian khalif rilis lagu alamak viral resmi ambar peras jatuh cinta prediksi hits cek lirik yuk lalu,Neutral
alamak adrian khalif rizky febian pergi besar bayi monster,Negative
perdana akustik alamak nyanyi asli rizky febian adr lalu,Neutral
rizky febian kolaborasi adrian khalif alamak gapake najisnye salma salsabil,Neutral
izin setor minta duluan ring txt dejavu doa marah koiro yelow harta karun rock seventen sahabat cinta zigaz alamak rizky febian cuek zombie eng versi hari pesawat ikon muka jahat gehehehe,Neutral
rizky febian kolaborasi adrian khalif alamak mahalini bawa,Neutral
sisa nyawa ibu klo ikut lagu alamak rizky febian,Neutral
rizky febian adrian khalif alamak juicy luicy lampu kuning,Neutral
suka dengerin lagu indonesia judul alamak rizky febian erti gk crzynya haechan,Positive
atas posisi rizky febian kolaborasi adrian khalif alamak stay tuned,Neutral
daya suami rizky febian alamak rekam,Neutral
tadi jatuh cinta alamak rizky febian sekarang justru candu kacamata afgan,Negative
mau yejun nyanyi alamak rizky febian adrian khalif,Neutral
malu hilang bagai bayang tahan diri jadi guna dicafe sini ngeplay alamak rizky febian,Negative
spotify hari top indonesia rizky febian alamak adrian khalif pamungkas monolog nadhif basalamah gema lama silet buka besar tabola bale jacson seran juan reza diva aurel hindia segala ht,Positive
rizky febian kolaborasi cantik bunyi alamak palsu,Neutral
sekarang buah indonesia tulis lirik alamak nyanyi rizky febian adrian khalif sangat buat tagih,Positive
gatau lagu alamak milik rizky febian tuh cocok buat meni daritadi dengerin beneran ingat ndkaodksjdj,Positive
uang minimal mau beli mobil listrik ah kini lebih hemat gak ramai ramah lingkung nah belanja judul lagu alamak rizky febian kolaborasi adrian khalif,Neutral
rizky febian adrian khalif alamak resmi lirik video kok suka kamera kunci lokasi satu tinggal nyanyi mondar mandir gak cupu jijik koreografer canggih,Neutral
auto main alamak rizky febian emang ganteng gemas,Positive
kelompok alamak rizky febian,Neutral
ungahanya tunjuk video tampil suara latar catat versi awal lagu alamak whatsapp dengar rizky febian sedang gumam melodi meski muncul lirik sangat tarik,Neutral
momen diungah salah satu cipta lagu alamak belanegara abe sama rizky febian adrian khalif iqbal siregar hinga kamga sebut proses buat sangat seru,Positive
bendung raya mau irigasi terus sawah negeri isi pangan semua alamak ini swasembada source music rizky febian adrian khalif,Negative
rizky febian nyanyi alamak sm kakak kev,Neutral
alamak rizky febian adrian khalif jemari juicy luicy pikir matang ungu lagu nikah bah,Neutral
suka lagu alamak bosen nyanyin,Positive
rizky febian adrian khalif alamak malam rawan,Neutral
sekarang putar alamak rizky febian gemes mksh udh update,Neutral
selamat nikmat music alamak rizky febian adrian khalif,Neutral
