dedup,hf_label
alamak rizky febian adrian khalif favorit baca abil erlang salting mesra kecil dulu sal priadi pasang melarat pandang kurang mampu vibesnya,Positive
chorus campur salma salsabil alamak rizky febian adrian khalif,Neutral
akhir kisah lama raisa kolaborasi barsena tak ujung rony parulian sesal salma salsabil salah alamak rizky febian adrian khalif,Neutral
alamak rizky febian khaira roy,Neutral
jvke faling cinta asa lama f y rizky febian alamak twice t monlight sunrise nct fact check rize talk saxy jujur rahasia,Neutral
alonica cause milik nik did pagi rizky febian alamak senja sudut kota,Neutral
wichu nct berharsp rel hubung svt joyride cortis alamak rizky febian,Neutral
kunci gitar alamak rizky febian adrian khalif chord dasar,Neutral
cinta chrisye untuku kala koda jatuh suka tulus nala labirin alamak rizky febian malam rawan kasmaran jaz dudy oriz sihir lyla sempurna andra backbone,Neutral
nyangka milklove se kasmaran kaya daftar putar lagu sekarang tuh alamak rizky febian akurat fix,Positive
alamak rizky febian adrian khalif bawa dita lalu dengerin gengs,Neutral
kalian erti lagu rizky febian judul alamak lirik nyawa nah selalu nyanyin rumah tuh kucing paksu percaya beneran hingga gasengaja gulir rel trus baru ngeh,Neutral
indah dunia tiara andini arsy widianto cinta luk ziva magnolya rizky febian alamak adrian khalif pilih maliq d esentials semenjak diri yovie hivi,Neutral
keren adrian khalif kolaborasi rizky febian alamak jakarta internasional veldrome terimakasih banyak semua libat acara temu tahun depan,Neutral
xl alamak rizky febian puja rahasia sheila atas pano zack tabudlo,Neutral
alamak rizky febian adrian khalif,Neutral
buah clan akustik alamak rizky febian,Neutral
tagih narly alamak rizky febian sing anthony xi ngapain repot maman fvndy gugur gunung bagus shidqi nah lo campur genre wkwkw,Neutral
alamak rizky febian kolaborasi adrian khalif awal kisah lama raisa bukan cinta biasa afgan buka hati yura yunita rasa indah tiara andini,Neutral
akhir xl lama rizky febian kolaborasi adrian alamak,Neutral
spotify hari top indonesia rizky febian alamak adrian khalif pamungkas monolog silet buka besar tabola bale jacson seran juan reza diva aurel nadhif basalamah gema lama hindia segala,Positive
rizky febian adrian khalif alamak chrisye untuku hivi remaja indah diri payung teduh ichamalia cerita jeje aramsa putra timur rengkuh mesra romantic echoes bunga,Neutral
alamak rizky febian suma tiba ganti lirik selina nyawa mau semua wkwkwk lebih nempel banding asli,Neutral
rizky febian alamak lyodra kolaborasi calum scot surga,Neutral
rizky febian adrian khalif cantik tingting kolaborasi nyanyin lagu alamak palsu,Neutral
lagu baru rizky febian judul alamak bengong pikir,Neutral
main alamak rizky febian adrian khalif,Neutral
gila lagu alamak rizky febian otomatis ganti otak sumur ladang mandi,Neutral
antara pandang pertama ran alamak rizky febian adrian khalif dekat hati paruh noah risalah dewa tetap cinta overtunes lebih indah adera maliq d esentials maf banyak mau,Positive
dengerin lagu alamak rizky febian,Positive
rizky febian alamak gelombang bumi buruk,Neutral
,Neutral
windu tulus alamak rizky febian,Neutral
rangga cinta suami malu rizky febian alamak nik la hilang,Neutral
rizky febian kolaborasi adrian khalif alamak sekarang rent fre otak alias tuh lagu cacing telinga parah anjrit,Positive
alamak rizky febian adrian khalif sempurna musik deskripsi asa,Neutral
after titik nadir candu malam rawan alamak rizky febian,Positive
lelah kira produksi simple atur alamak rizky febian adrian khalif,Neutral
alamak rizky febian kolaborasi adrian khalif oktober konser korban patah hati veledrome jakarta,Neutral
terimakasih alamak rizky febian adrian khalif milik baru main indonesia music pandang tulis bagus sekali,Positive
jebak mata tutup zayn jiso alamak rizky febian adrian khalif,Negative
rizky febian duet cantik bunyi lagu alamak palsu,Positive
kata rizky febian sembilan nyawa mau sama semua dada isi alamak ini jatuh cinta fix wintang era kebucinanan,Positive
alamak rizky febian,Neutral
otak reflek putar lagu rizky febian alamak,Positive
musik pagi hari alamak rizky febian kolaborasi adrian khalif dengerin lagu vibes yochae can t henti smiling telinga,Neutral
akhir alamak versi original rizky febian adrian khalif nyawa mau sama semua dada isi jackson wang,Positive
mau org bosen bilang lagu alamak adrian khalif rizky febian msh rasa centil apabila dengar,Positive
alamak kok gin banyak nyawa org gaya karakter semua milik tempat hati rizky febian bilang carat mau langsung bias cuma satu padahal mah jamin bong,Negative
anjay alamak versi jakarta langsung rizky febian,Neutral
way bruno mars kosong menang o omg newjeans n malu itzy g garam madu sakit dada tenxi jemsi naykila halstage musim panas nik evaluasi hindia buah alamak rizky febian adrian khalif nina feast,Neutral
lompat blackpink buah alamak rizky febian n apink g gabriela katseye wow btob o bayi cinta laura nunu nana jesi y satu boa understand keshi doubt enhypen ge snsd,Neutral
lirik lagu alamak rizky febian adrian khalif nyawa perspektif ekonomi baca lengkap,Neutral
sangat cantik wanita rizky febian kolaborasi adrian khalif alamak,Positive
alamak rizky febian adrian khalif gila tulus,Neutral
lucu balik benjakiti terus ojek serempet temen bilang jatuh sakit cinta alamak rizky febian anjir definisi nyawa,Neutral
nyawa akhir puluh ribu minta lagu dinyanyin satu alamak rizky febian,Neutral
bangun gara sakit perut dengerin lagu alamak nyawa rizky febian adrian khalif padahal sedih,Positive
istri nyanyi lagu rizky febian viral judul alamak justru sembilan nyawa sumur ladang nyuci motor nengak air putih otomatis langsung mual,Positive
alamak rizky febian kyknya blm dengerin soale,Neutral
minat minta bes alamak rizky febian,Neutral
kata rizky febian nyawa mau renjun semua dada isi alamak jatuh cinta,Positive
kata bang rizky febian alamak,Neutral
selamat selimut dek emang bener wangi yaudin pergi makasih semangatin semangat alamak lagu rizky febian,Positive
mau coba ah itung buat bayar mingu gak streaming harap it guys singtober alamak rizky febian adrian khalif,Neutral
rizky febian sama adrian khalif rilis sendiri judul alamak kini lagu viral bagi lirik sembilan nyawa dapat banyak sorot netizen cipta belanegara abe iqbal siregar kaleb,Positive
yes buah indonesia tulis rizky febian alamak,Neutral
fakta tarik lagu alamak nyanyi rizky febian adrian khalif,Neutral
angkut mohon bening mau jadi paragonian dada belah isi paragon nyanyi lagu rizky febian alamak,Neutral
main atas rizky febian alamak park jihon,Neutral
tulis alamak rizky febian adrian khalif goyang igs,Neutral
rizky febian kolaborasi adrian khalif alamak ngehits,Positive
alamak rizky febian atas ulang,Neutral
rendah anggar edit can t beri anything than imovie tulis guna rizky febian adrian khalif alamak,Neutral
lagu rizky febian baru judul alamak,Neutral
minta bawa lagu alamak rizky febian,Neutral
alamak rizky febian kolaborasi adrian khalif,Neutral
mau dengerin lagu adrian khalif rizky febian justru setel cantik bunyi nyata alamak palsu,Neutral
rizky febian alamak,Neutral
indah lagu rizky febian adrian khalif judul alamak,Positive
